{
  "carrera": "Maestría en Derecho Procesal",
  "slug": "maestria-derecho-procesal",
  "universidad": {
    "id": "unicaribe",
    "nombre": "Universidad del Caribe"
  },
  "grado": "postgrado",
  "version": "2024-10",
  "vigente": true,
  "duracion": {
    "periodos": 6,
    "tipoPeriodo": "cuatrimestre"
  },
  "totales": {
    "asignaturas": 23,
    "creditos": 53
  },
  "materias": [
    {
      "codigo": "MPP-111",
      "cuatrimestre": 1,
      "nombre": "METODOLOGÍA DE LA INVESTIGACIÓN",
      "creditos": 3,
      "prerequisitos": [],
      "requiereTodas": false
    },
    {
      "codigo": "MPP-112",
      "cuatrimestre": 1,
      "nombre": "TEORÍA DEL DELITO",
      "creditos": 2,
      "prerequisitos": [],
      "requiereTodas": false
    },
    {
      "codigo": "MPP-113",
      "cuatrimestre": 1,
      "nombre": "GARANTÍAS CONSTITUCIONALES DEL DERECHO PENAL",
      "creditos": 2,
      "prerequisitos": [],
      "requiereTodas": false
    },
    {
      "codigo": "MPP-114",
      "cuatrimestre": 1,
      "nombre": "CRIMINOLOGÍA",
      "creditos": 2,
      "prerequisitos": [],
      "requiereTodas": false
    },
    {
      "codigo": "MPP-121",
      "cuatrimestre": 2,
      "nombre": "LOS PRINCIPIOS DEL PROCESO PENAL",
      "creditos": 2,
      "prerequisitos": [
        "MPP-112"
      ],
      "requiereTodas": false
    },
    {
      "codigo": "MPP-122",
      "cuatrimestre": 2,
      "nombre": "DERECHO PENAL Y PROCESAL PENAL",
      "creditos": 2,
      "prerequisitos": [
        "MPP-113"
      ],
      "requiereTodas": false
    },
    {
      "codigo": "MPP-123",
      "cuatrimestre": 2,
      "nombre": "INTERPRETACIÓN DE LA LEY PENAL",
      "creditos": 2,
      "prerequisitos": [
        "MPP-112"
      ],
      "requiereTodas": false
    },
    {
      "codigo": "MPP-124",
      "cuatrimestre": 2,
      "nombre": "CONSTITUCIONALIZACIÓN DEL DERECHO PROCESAL PENAL",
      "creditos": 2,
      "prerequisitos": [
        "MPP-113"
      ],
      "requiereTodas": false
    },
    {
      "codigo": "MPP-131",
      "cuatrimestre": 3,
      "nombre": "SISTEMA PROCESAL INQUISITORIO VS SISTEMA ACUSATORIO",
      "creditos": 2,
      "prerequisitos": [
        "MPP-122"
      ],
      "requiereTodas": false
    },
    {
      "codigo": "MPP-132",
      "cuatrimestre": 3,
      "nombre": "LA PRUEBA EN EL PROCESO PENAL",
      "creditos": 2,
      "prerequisitos": [
        "MPP-122"
      ],
      "requiereTodas": false
    },
    {
      "codigo": "MPP-133",
      "cuatrimestre": 3,
      "nombre": "LA ETAPA INTERMEDIA",
      "creditos": 2,
      "prerequisitos": [
        "MPP-121"
      ],
      "requiereTodas": false
    },
    {
      "codigo": "MPP-134",
      "cuatrimestre": 3,
      "nombre": "MEDIDAS DE COERCIÓN",
      "creditos": 2,
      "prerequisitos": [
        "MPP-122"
      ],
      "requiereTodas": false
    },
    {
      "codigo": "MPP-211",
      "cuatrimestre": 4,
      "nombre": "LOS SUJETOS PROCESALES",
      "creditos": 2,
      "prerequisitos": [
        "MPP-131"
      ],
      "requiereTodas": false
    },
    {
      "codigo": "MPP-213",
      "cuatrimestre": 4,
      "nombre": "LOS PROCEDIMIENTOS ESPECIALES",
      "creditos": 2,
      "prerequisitos": [
        "MPP-133"
      ],
      "requiereTodas": false
    },
    {
      "codigo": "MPP-214",
      "cuatrimestre": 4,
      "nombre": "DERECHO PENAL ECONÓMICO",
      "creditos": 2,
      "prerequisitos": [
        "MPP-113"
      ],
      "requiereTodas": false
    },
    {
      "codigo": "MPP-215",
      "cuatrimestre": 4,
      "nombre": "SEMINARIO DE INVESTIGACIÓN I",
      "creditos": 3,
      "prerequisitos": [
        "MPP-111"
      ],
      "requiereTodas": false
    },
    {
      "codigo": "MPP-221",
      "cuatrimestre": 5,
      "nombre": "ÉTICA JURÍDICA",
      "creditos": 1,
      "prerequisitos": [],
      "requiereTodas": false
    },
    {
      "codigo": "MPP-220",
      "cuatrimestre": 5,
      "nombre": "DERECHO PENAL INTERNACIONAL CONTEMPORÁNEO",
      "creditos": 2,
      "prerequisitos": [
        "MPP-123"
      ],
      "requiereTodas": false
    },
    {
      "codigo": "MPP-224",
      "cuatrimestre": 5,
      "nombre": "EL JUICIO ORAL Y TÉCNICAS DE LITIGACIÓN",
      "creditos": 3,
      "prerequisitos": [
        "MPP-121"
      ],
      "requiereTodas": false
    },
    {
      "codigo": "MPP-222",
      "cuatrimestre": 5,
      "nombre": "LOS RECURSOS",
      "creditos": 2,
      "prerequisitos": [
        "MPP-132"
      ],
      "requiereTodas": false
    },
    {
      "codigo": "MPP-223",
      "cuatrimestre": 6,
      "nombre": "LA EJECUCIÓN PENAL",
      "creditos": 2,
      "prerequisitos": [
        "MPP-132"
      ],
      "requiereTodas": false
    },
    {
      "codigo": "MPP-233",
      "cuatrimestre": 6,
      "nombre": "SEMINARIO DE INVESTIGACIÓN II",
      "creditos": 3,
      "prerequisitos": [
        "MPP-215"
      ],
      "requiereTodas": false
    },
    {
      "codigo": "MPP-235",
      "cuatrimestre": 6,
      "nombre": "TESIS",
      "creditos": 6,
      "prerequisitos": [],
      "requiereTodas": true,
      "observaciones": "PRE-REQ del PDF: TODAS (todas las asignaturas previas)"
    }
  ],
  "reglas": {
    "escala": {
      "base": 100,
      "minimo": 70,
      "maximo": 100,
      "aprobacion": 70,
      "formaIndice": "no-verificado"
    },
    "honores": [
      {
        "grado": "cum-laude",
        "min": 85,
        "max": 89,
        "fuente": {
          "url": "https://unicaribe.edu.do/wp-content/uploads/2024/11/Reglamento-Estudiantil-1.pdf",
          "sha256": "25be4df46cc38f4254844a301c5904b886bcd6e69e2900c507141561aa8410bd",
          "verificadoEn": "2026-10-05",
          "archivo": "Reglamento-Estudiantil-1.pdf"
        }
      },
      {
        "grado": "magna-cum-laude",
        "min": 90,
        "max": 94,
        "fuente": {
          "url": "https://unicaribe.edu.do/wp-content/uploads/2024/11/Reglamento-Estudiantil-1.pdf",
          "sha256": "25be4df46cc38f4254844a301c5904b886bcd6e69e2900c507141561aa8410bd",
          "verificadoEn": "2026-10-05",
          "archivo": "Reglamento-Estudiantil-1.pdf"
        }
      },
      {
        "grado": "summa-cum-laude",
        "min": 95,
        "max": 100,
        "fuente": {
          "url": "https://unicaribe.edu.do/wp-content/uploads/2024/11/Reglamento-Estudiantil-1.pdf",
          "sha256": "25be4df46cc38f4254844a301c5904b886bcd6e69e2900c507141561aa8410bd",
          "verificadoEn": "2026-10-05",
          "archivo": "Reglamento-Estudiantil-1.pdf"
        }
      }
    ],
    "requisitosHonores": {
      "sinReprobaciones": true,
      "exclusiones": [
        "separacion temporal (Art. 89, excepcion b)",
        "sancion disciplinaria (Art. 89, excepcion c)"
      ]
    },
    "fuente": {
      "url": "https://unicaribe.edu.do/wp-content/uploads/2024/11/Reglamento-Estudiantil-1.pdf",
      "sha256": "25be4df46cc38f4254844a301c5904b886bcd6e69e2900c507141561aa8410bd",
      "verificadoEn": "2026-10-05",
      "archivo": "Reglamento-Estudiantil-1.pdf"
    }
  },
  "notas": [
    "Curaduria del lote de maestrias de UNICARIBE (batch 3, 2026-10-10). Se curan 5 de las 6 carreras; la sexta (maestria-mercadeo-turistico) queda PENDIENTE por una errata de la fuente que no se puede resolver sin inventar (ver 'pendientes').",
    "Reglas de postgrado: escala (base 100, aprobacion 70) y honores (cum-laude 85-89, magna-cum-laude 90-94, summa-cum-laude 95-100) se copian de la plantilla institucional de UNICARIBE (Reglamento Estudiantil, sha256 25be4df46cc38f4254844a301c5904b886bcd6e69e2900c507141561aa8410bd); el PDF del pensum no menciona honores y su aplicabilidad a este nivel de postgrado queda NO VERIFICADO (honores = NO VERIFICADO).",
    "Los PDF de estas maestrias traen columnas de horas (HT/HP/HI; maestria-comunicacion-politica-marketing-digital ademas HRS) que el schema actual no almacena; el valor guardado es el credito (CR).",
    "Ninguno de estos PDF declara fecha ni version interna: el campo 'version' de cada JSON proviene de la ruta de la URL oficial (UNVERIFIABLE).",
    "El PDF declara TOTAL DE CREDITOS 53 (pagina 2, cierre de la tabla): coincide con la suma de las 23 filas. El numero de asignaturas no se imprime; 23 es la cuenta de las filas.",
    "MPP-132, MPP-214 y MPP-223 no fueron detectadas por el extractor por coordenadas: sus lineas van intercaladas con el texto lateral 'Perfil profesional' de la p.2. Se recuperan del texto de la pagina y cuadran con el TOTAL DE CREDITOS 53 (47 + 2 + 2 + 2 = 53). Sin MPP-132, el prerrequisito de MPP-222 (LOS RECURSOS) apuntaba a un codigo inexistente.",
    "El generador de borradores asigno el cuatrimestre 3 a MPP-211, MPP-213 y MPP-215: la cabecera 'CUARTO CUATRIMESTRE' de la p.2 viene pegada al texto lateral ('Perfil profesional') y no se detecto como bloque. Se corrigen a cuatrimestre 4 (asi lo agrupa la tabla del PDF) para que el orden cuatrimestral sea el del pensum.",
    "Las columnas del PDF son CLAVE ASIGNATURA HT HP HI CR PRERREQUISTO (horas antes que creditos): el credito es la CUARTA cifra tras el nombre."
  ],
  "fuente": {
    "url": "https://unicaribe.edu.do/wp-content/uploads/2024/10/Maestria-derecho-procesal_compressed.pdf",
    "sha256": "cab410736c75df7068b24e905d3e895441cb23685d21c98a50f91763f9d678b0",
    "verificadoEn": "2026-10-08",
    "archivo": "Maestria-derecho-procesal_compressed.pdf"
  }
}
