{
  "carrera": "Especialidad en Habilitación Docente: Biología para el Nivel Secundario",
  "slug": "especialidad-biologia-secundaria",
  "universidad": {
    "id": "unicaribe",
    "nombre": "Universidad del Caribe"
  },
  "grado": "postgrado",
  "version": "2024-11",
  "vigente": true,
  "duracion": {
    "periodos": 3,
    "tipoPeriodo": "periodo"
  },
  "totales": {
    "asignaturas": 10,
    "creditos": 32
  },
  "materias": [
    {
      "codigo": "EHD-111",
      "cuatrimestre": 1,
      "nombre": "IDENTIDAD Y ÉTICA DEL PROFESIONAL DOCENTE",
      "creditos": 2,
      "prerequisitos": [],
      "requiereTodas": false
    },
    {
      "codigo": "EHDB-112",
      "cuatrimestre": 1,
      "nombre": "FUNDAMENTOS Y CARACTERÍSTICAS DEL CURRÍCULO DE BIOLOGÍA PARA EL NIVEL SECUNDARIO",
      "creditos": 4,
      "prerequisitos": [],
      "requiereTodas": false
    },
    {
      "codigo": "EHD-113",
      "cuatrimestre": 1,
      "nombre": "PSICOLOGÍA DEL DESARROLLO ADOLESCENTE",
      "creditos": 3,
      "prerequisitos": [],
      "requiereTodas": false
    },
    {
      "codigo": "EHD-214",
      "cuatrimestre": 2,
      "nombre": "PROCESO DE ENSEÑANZA APRENDIZAJE",
      "creditos": 4,
      "prerequisitos": [],
      "requiereTodas": false
    },
    {
      "codigo": "EHD-221",
      "cuatrimestre": 2,
      "nombre": "EVALUACIÓN DE LOS APRENDIZAJES",
      "creditos": 3,
      "prerequisitos": [
        "EHDB-112"
      ],
      "requiereTodas": false
    },
    {
      "codigo": "EHD-222",
      "cuatrimestre": 2,
      "nombre": "MEDIOS Y RECURSOS PARA EL APRENDIZAJE",
      "creditos": 3,
      "prerequisitos": [
        "EHDB-112"
      ],
      "requiereTodas": false
    },
    {
      "codigo": "EHDB-223",
      "cuatrimestre": 2,
      "nombre": "DIDÁCTICA ESPECIAL DE LA BIOLOGÍA Y PRÁCTICA DOCENTE PARA EL NIVEL SECUNDARIO I",
      "creditos": 4,
      "prerequisitos": [
        "EHDB-112"
      ],
      "requiereTodas": false
    },
    {
      "codigo": "EHDB-332",
      "cuatrimestre": 3,
      "nombre": "DIDÁCTICA ESPECIAL DE LA BIOLOGÍA Y PRÁCTICA DOCENTE PARA EL NIVEL SECUNDARIO II",
      "creditos": 4,
      "prerequisitos": [],
      "requiereTodas": false
    },
    {
      "codigo": "EHD-331",
      "cuatrimestre": 3,
      "nombre": "PSICOLOGÍA EDUCATIVA",
      "creditos": 2,
      "prerequisitos": [],
      "requiereTodas": false
    },
    {
      "codigo": "EHDB-333",
      "cuatrimestre": 3,
      "nombre": "PROYECTO PEDAGÓGICO DE BIOLOGÍA PARA EL NIVEL SECUNDARIO",
      "creditos": 3,
      "prerequisitos": [],
      "requiereTodas": false
    }
  ],
  "reglas": {
    "escala": {
      "base": 100,
      "minimo": 70,
      "maximo": 100,
      "aprobacion": 70,
      "formaIndice": "no-verificado"
    },
    "honores": [
      {
        "grado": "cum-laude",
        "min": 85,
        "max": 89,
        "fuente": {
          "url": "https://unicaribe.edu.do/wp-content/uploads/2024/11/Reglamento-Estudiantil-1.pdf",
          "sha256": "25be4df46cc38f4254844a301c5904b886bcd6e69e2900c507141561aa8410bd",
          "verificadoEn": "2026-10-05",
          "archivo": "Reglamento-Estudiantil-1.pdf"
        }
      },
      {
        "grado": "magna-cum-laude",
        "min": 90,
        "max": 94,
        "fuente": {
          "url": "https://unicaribe.edu.do/wp-content/uploads/2024/11/Reglamento-Estudiantil-1.pdf",
          "sha256": "25be4df46cc38f4254844a301c5904b886bcd6e69e2900c507141561aa8410bd",
          "verificadoEn": "2026-10-05",
          "archivo": "Reglamento-Estudiantil-1.pdf"
        }
      },
      {
        "grado": "summa-cum-laude",
        "min": 95,
        "max": 100,
        "fuente": {
          "url": "https://unicaribe.edu.do/wp-content/uploads/2024/11/Reglamento-Estudiantil-1.pdf",
          "sha256": "25be4df46cc38f4254844a301c5904b886bcd6e69e2900c507141561aa8410bd",
          "verificadoEn": "2026-10-05",
          "archivo": "Reglamento-Estudiantil-1.pdf"
        }
      }
    ],
    "requisitosHonores": {
      "sinReprobaciones": true,
      "exclusiones": [
        "separacion temporal (Art. 89, excepcion b)",
        "sancion disciplinaria (Art. 89, excepcion c)"
      ]
    },
    "fuente": {
      "url": "https://unicaribe.edu.do/wp-content/uploads/2024/11/Reglamento-Estudiantil-1.pdf",
      "sha256": "25be4df46cc38f4254844a301c5904b886bcd6e69e2900c507141561aa8410bd",
      "verificadoEn": "2026-10-05",
      "archivo": "Reglamento-Estudiantil-1.pdf"
    }
  },
  "notas": [
    "El PDF del pensum (pagina 3) no imprime fila de totales: los totales declarados (10 asignaturas, 32 creditos) son la suma directa de las filas de los tres periodos. Las filas de EHDB-332, EHD-331 y EHDB-333 van sin PRERREQUISTO en la fuente.",
    "Honores academicos (cum-laude 85-89, magna-cum-laude 90-94, summa-cum-laude 95-100) y escala (base 100, aprobacion 70) copiados de la plantilla institucional de UNICARIBE (Reglamento Estudiantil, sha256 25be4df46cc38f4254844a301c5904b886bcd6e69e2900c507141561aa8410bd); el PDF del pensum no los menciona y su aplicabilidad a este nivel de postgrado es NO VERIFICADO."
  ],
  "fuente": {
    "url": "https://unicaribe.edu.do/wp-content/uploads/2024/11/V20200814-Especialidad-en-Habilitacion-Docente-Biologia-para-el-Nivel-Secundario.pdf",
    "sha256": "504718d7b2094d2192e075c07005449231d90b074c06047a3d0c691ad00086d3",
    "verificadoEn": "2026-10-08",
    "archivo": "V20200814-Especialidad-en-Habilitacion-Docente-Biologia-para-el-Nivel-Secundario.pdf"
  }
}
